{
  "$schema": "./cases.schema.json",
  "$comment": "DETERMINISTIC evaluation of the harness (scripts/harness-eval.mjs, a gate signal), grouped by WHEN the piece acts: `guides` before the agent decides, `rules` before a tool runs, `signals` after acting. Every label says what a GOOD harness should do, not what it does today. The shape is cases.schema.json; `lang` marks the language of a case's human content (es | en; absent = neutral). Keys and enum values are English; prompts, messages and file contents are in the case's language. The Spanish strings in `contains` (`**bugfix**`) and in `reasonCriteria.nextStep` are compared against the harness output, which speaks Spanish.",
  "events": {
    "prompt": "UserPromptSubmit",
    "tool": "PreToolUse",
    "afterTool": "PostToolUse",
    "turnEnd": "Stop",
    "subagentEnd": "SubagentStop"
  },
  "files": {
    "package.json": "{\n  \"name\": \"eval\",\n  \"version\": \"1.0.0\"\n}\n",
    "src/app.js": "export const x = 1;\n",
    "src/build/index.js": "export const y = 2;\n",
    ".env": "API_KEY=sk-live_abcdefghijklmnop1234\n",
    ".env.example": "API_KEY=\n",
    "dist/app.js": "var x=1;\n",
    "node_modules/dep/index.js": "module.exports = 1;\n",
    "docs/notes.md": "# notes\n"
  },
  "guides": {
    "$comment": "Before the agent decides. `intent`: is the prompt a question to answer or an action to take (the ask-first marker). `prompt`: what the prompt hooks put in front of the agent. Plus `reasonCriteria`, applied to every reason the `rules` run produced.",
    "thresholds": {
      "minScore": 1
    },
    "reasonCriteria": {
      "$comment": "A block that says what happened but not what to do is retried as is. Spanish on purpose: it is matched against the harness messages. Word edges are `(?<!\\p{L})…(?!\\p{L})` and not `\\b`: in JavaScript `\\b` is ASCII, so `contestá\\b` never matches.",
      "minLength": 60,
      "nextStep": [
        "(?<!\\p{L})(us[áa]|corr[ée]|ped[íi]|pedile|ped[íi]selo|reformul[áa]|list[áa]|baj[áa]|esperalo|contest[áa]|termin[áa]|agreg[áa]|ampli[áa]|par[áa]|contale|mostr[áa]|confirm[áa]|descart[áa]|dej[áa]|revis[áa]|proponelo)(?!\\p{L})",
        "(?<!\\p{L})(dry-run|confirmaci[óo]n|que (lo )?(confirme|corra|haga|lea|pase) el humano)(?!\\p{L})"
      ]
    },
    "items": [
      {
        "id": "intent-why-fails-es",
        "type": "intent",
        "lang": "es",
        "text": "¿por qué falla el build?",
        "expected": "question",
        "note": "a question about a failure"
      },
      {
        "id": "intent-why-fails-en",
        "type": "intent",
        "lang": "en",
        "text": "why does the build fail?",
        "expected": "question",
        "note": "a question about a failure"
      },
      {
        "id": "intent-what-does-es",
        "type": "intent",
        "lang": "es",
        "text": "qué hace src/app.js",
        "expected": "question",
        "note": "a question without question marks"
      },
      {
        "id": "intent-what-does-en",
        "type": "intent",
        "lang": "en",
        "text": "what does src/app.js do",
        "expected": "question",
        "note": "a question without question marks"
      },
      {
        "id": "intent-how-install-es",
        "type": "intent",
        "lang": "es",
        "text": "cómo se instala el arnés",
        "expected": "question",
        "note": "a how-to question that names an action verb as its topic"
      },
      {
        "id": "intent-how-install-en",
        "type": "intent",
        "lang": "en",
        "text": "how do I install the harness",
        "expected": "question",
        "note": "a how-to question that names an action verb as its topic"
      },
      {
        "id": "intent-did-you-apply-es",
        "type": "intent",
        "lang": "es",
        "text": "¿aplicaste el cambio?",
        "expected": "question",
        "note": "an action verb in the past asks about what was done"
      },
      {
        "id": "intent-did-you-apply-en",
        "type": "intent",
        "lang": "en",
        "text": "did you apply the change?",
        "expected": "question",
        "note": "an action verb in the past asks about what was done"
      },
      {
        "id": "intent-is-there-es",
        "type": "intent",
        "lang": "es",
        "text": "¿hay algún test para el login?",
        "expected": "question",
        "note": "a yes/no question"
      },
      {
        "id": "intent-is-there-en",
        "type": "intent",
        "lang": "en",
        "text": "is there a test for the login?",
        "expected": "question",
        "note": "a yes/no question"
      },
      {
        "id": "intent-fix-it-es",
        "type": "intent",
        "lang": "es",
        "text": "arreglá el build",
        "expected": "action",
        "note": "an imperative"
      },
      {
        "id": "intent-fix-it-en",
        "type": "intent",
        "lang": "en",
        "text": "fix the build",
        "expected": "action",
        "note": "an imperative"
      },
      {
        "id": "intent-polite-request-es",
        "type": "intent",
        "lang": "es",
        "text": "¿podés arreglar el build?",
        "expected": "action",
        "note": "a request shaped as a polite question"
      },
      {
        "id": "intent-polite-request-en",
        "type": "intent",
        "lang": "en",
        "text": "can you fix the build?",
        "expected": "action",
        "note": "a request shaped as a polite question"
      },
      {
        "id": "intent-add-test-es",
        "type": "intent",
        "lang": "es",
        "text": "agregá un test para el login",
        "expected": "action",
        "note": "an imperative with an object"
      },
      {
        "id": "intent-add-test-en",
        "type": "intent",
        "lang": "en",
        "text": "add a test for the login",
        "expected": "action",
        "note": "an imperative with an object"
      },
      {
        "id": "intent-please-update-es",
        "type": "intent",
        "lang": "es",
        "text": "por favor actualizá el README",
        "expected": "action",
        "note": "a request that starts with please"
      },
      {
        "id": "intent-please-update-en",
        "type": "intent",
        "lang": "en",
        "text": "please update the README",
        "expected": "action",
        "note": "a request that starts with please"
      },
      {
        "id": "route-bug-es",
        "type": "prompt",
        "lang": "es",
        "text": "hay un bug en el login",
        "expected": "injects",
        "contains": [
          "**bugfix**"
        ],
        "note": "a bug report routes to a red test first"
      },
      {
        "id": "route-bug-en",
        "type": "prompt",
        "lang": "en",
        "text": "there is a bug in the login",
        "expected": "injects",
        "contains": [
          "**bugfix**"
        ],
        "note": "a bug report routes to a red test first"
      },
      {
        "id": "route-broken-es",
        "type": "prompt",
        "lang": "es",
        "text": "el login no funciona",
        "expected": "injects",
        "contains": [
          "**bugfix**"
        ],
        "note": "a failure without the word bug"
      },
      {
        "id": "route-broken-en",
        "type": "prompt",
        "lang": "en",
        "text": "the login doesn't work",
        "expected": "injects",
        "contains": [
          "**bugfix**"
        ],
        "note": "a failure without the word bug"
      },
      {
        "id": "route-regression-es",
        "type": "prompt",
        "lang": "es",
        "text": "esto es una regresión del release anterior",
        "expected": "injects",
        "contains": [
          "**bugfix**"
        ],
        "note": "a regression"
      },
      {
        "id": "route-regression-en",
        "type": "prompt",
        "lang": "en",
        "text": "this is a regression from the last release",
        "expected": "injects",
        "contains": [
          "**bugfix**"
        ],
        "note": "a regression"
      },
      {
        "id": "route-feature-es",
        "type": "prompt",
        "lang": "es",
        "text": "nueva feature de pagos con tarjeta",
        "expected": "injects",
        "contains": [
          "**sdd**"
        ],
        "note": "a feature-sized request routes to SDD"
      },
      {
        "id": "route-feature-en",
        "type": "prompt",
        "lang": "en",
        "text": "new feature for card payments",
        "expected": "injects",
        "contains": [
          "**sdd**"
        ],
        "note": "a feature-sized request routes to SDD"
      },
      {
        "id": "route-user-stories-es",
        "type": "prompt",
        "lang": "es",
        "text": "escribí las historias de usuario del checkout",
        "expected": "injects",
        "contains": [
          "**sdd**"
        ],
        "note": "user stories are feature work"
      },
      {
        "id": "route-user-stories-en",
        "type": "prompt",
        "lang": "en",
        "text": "write the user stories for the checkout",
        "expected": "injects",
        "contains": [
          "**sdd**"
        ],
        "note": "user stories are feature work"
      },
      {
        "id": "route-refactor-es",
        "type": "prompt",
        "lang": "es",
        "text": "refactorizá el módulo de pagos",
        "expected": "injects",
        "contains": [
          "**architecture**"
        ],
        "note": "a design change"
      },
      {
        "id": "route-refactor-en",
        "type": "prompt",
        "lang": "en",
        "text": "refactor the payments module",
        "expected": "injects",
        "contains": [
          "**architecture**"
        ],
        "note": "a design change"
      },
      {
        "id": "route-coupling-es",
        "type": "prompt",
        "lang": "es",
        "text": "este módulo tiene mucho acoplamiento",